{
  "schema": "t81.research-commons.manifest.v1",
  "version": "1.0.0",
  "repository": "https://github.com/t81dev/t81-foundation",
  "baseline_revision": "274421fd8e85c5b9bb4f165fce190715530f4e85",
  "scope": "Curated initial read-only index. No independent scientific verification or live PR/CI status.",
  "sources": [
    {
      "id": "charter",
      "path": "docs/research/continuity/MASTER_CONTINUITY_CHARTER_v1.0.md",
      "revision": "274421fd8e85c5b9bb4f165fce190715530f4e85",
      "sha256": "bb073bafcd00a81d6790558d05ab60b2e53eee9a8724e19563228983bc575ca7",
      "url": "https://github.com/t81dev/t81-foundation/blob/274421fd8e85c5b9bb4f165fce190715530f4e85/docs/research/continuity/MASTER_CONTINUITY_CHARTER_v1.0.md",
      "role": "authority",
      "uncertainty": "Continuity and research intent, not implementation certification."
    },
    {
      "id": "register",
      "path": "docs/research/continuity/HYPOTHESIS_REGISTER_v1.json",
      "revision": "274421fd8e85c5b9bb4f165fce190715530f4e85",
      "sha256": "af8ca65dcef136f294eb33010b5a6621875a52db4f3e60b94a4e28db5318a1c1",
      "url": "https://github.com/t81dev/t81-foundation/blob/274421fd8e85c5b9bb4f165fce190715530f4e85/docs/research/continuity/HYPOTHESIS_REGISTER_v1.json",
      "role": "authority",
      "uncertainty": "Historical dispositions as of 2026-10-25; later evidence is linked separately."
    },
    {
      "id": "research-charter",
      "path": "docs/research/RESEARCH_CHARTER.md",
      "revision": "274421fd8e85c5b9bb4f165fce190715530f4e85",
      "sha256": "a89e4c4338fc8b91412a862db24512d44f38d07f84f3e2c45b195c18fc49b4fa",
      "url": "https://github.com/t81dev/t81-foundation/blob/274421fd8e85c5b9bb4f165fce190715530f4e85/docs/research/RESEARCH_CHARTER.md",
      "role": "authority",
      "uncertainty": "Research directive; does not amend canonical hypothesis identities."
    },
    {
      "id": "agent-rules",
      "path": "AGENTS.md",
      "revision": "274421fd8e85c5b9bb4f165fce190715530f4e85",
      "sha256": "b84c2b899b09efa8b8e418a22d966a64049c2b9d0cc411ebb12b018c5fd90255",
      "url": "https://github.com/t81dev/t81-foundation/blob/274421fd8e85c5b9bb4f165fce190715530f4e85/AGENTS.md",
      "role": "governance",
      "uncertainty": "Rules at the pinned baseline; current checkout may add onboarding guidance."
    },
    {
      "id": "authority-model",
      "path": "docs/governance/SPEC_AUTHORITY_MODEL.md",
      "revision": "274421fd8e85c5b9bb4f165fce190715530f4e85",
      "sha256": "1592ee73a96456cc167e31c419c0f4677f9f6d7c7fa6ea3542fc926d8548aab5",
      "url": "https://github.com/t81dev/t81-foundation/blob/274421fd8e85c5b9bb4f165fce190715530f4e85/docs/governance/SPEC_AUTHORITY_MODEL.md",
      "role": "governance",
      "uncertainty": "Specification authority is distinct from measured behavior."
    },
    {
      "id": "lineage",
      "path": "docs/research/continuity/LINEAGE.md",
      "revision": "274421fd8e85c5b9bb4f165fce190715530f4e85",
      "sha256": "23a8ac97fb993059a81c1829929e6b1ede94ad66279b10be0c928f955c24d5cc",
      "url": "https://github.com/t81dev/t81-foundation/blob/274421fd8e85c5b9bb4f165fce190715530f4e85/docs/research/continuity/LINEAGE.md",
      "role": "reported",
      "uncertainty": "Pinned source archaeology; no new independent reproduction here."
    },
    {
      "id": "source-pins",
      "path": "docs/research/continuity/evidence/source-pins.json",
      "revision": "274421fd8e85c5b9bb4f165fce190715530f4e85",
      "sha256": "55184b2d252a1f5b501c30d05381404797ff0bf82e3a4180de34ba509d2780cc",
      "url": "https://github.com/t81dev/t81-foundation/blob/274421fd8e85c5b9bb4f165fce190715530f4e85/docs/research/continuity/evidence/source-pins.json",
      "role": "identity",
      "uncertainty": "External repositories are not automatically fetched or verified."
    },
    {
      "id": "continuity-handoff",
      "path": "docs/research/continuity/SESSION_HANDOFF.md",
      "revision": "274421fd8e85c5b9bb4f165fce190715530f4e85",
      "sha256": "3e239914d6f63704989c18eccbb7098345ab52ff9af4b125dbbda7e3c200a6fc",
      "url": "https://github.com/t81dev/t81-foundation/blob/274421fd8e85c5b9bb4f165fce190715530f4e85/docs/research/continuity/SESSION_HANDOFF.md",
      "role": "reported",
      "uncertainty": "Historical session and PR status; not live readiness."
    },
    {
      "id": "storage-model",
      "path": "docs/research/continuity/evidence/storage-boundary-results.json",
      "revision": "274421fd8e85c5b9bb4f165fce190715530f4e85",
      "sha256": "bf125deb36d73129f154a7074e2888cf4c159c78cd48b2b504a061d1d83de885",
      "url": "https://github.com/t81dev/t81-foundation/blob/274421fd8e85c5b9bb4f165fce190715530f4e85/docs/research/continuity/evidence/storage-boundary-results.json",
      "role": "modeled",
      "uncertainty": "Conditional exact model, not device measurement."
    },
    {
      "id": "storage-probe",
      "path": "docs/research/continuity/probes/storage_boundary.py",
      "revision": "274421fd8e85c5b9bb4f165fce190715530f4e85",
      "sha256": "138da102790dc642b691c6cf97c01f42a9d5e7477ad96cfaa82341bc7c7097da",
      "url": "https://github.com/t81dev/t81-foundation/blob/274421fd8e85c5b9bb4f165fce190715530f4e85/docs/research/continuity/probes/storage_boundary.py",
      "role": "reproduction",
      "uncertainty": "Instructions/source only; Commons never executes this probe."
    },
    {
      "id": "hanoi-negative",
      "path": "docs/research/continuity/evidence/hanoi-arithmetic-results.json",
      "revision": "274421fd8e85c5b9bb4f165fce190715530f4e85",
      "sha256": "2957f5f37c29ce57a881f8968c597e24a91e0145dc13f36e39094cdccb192aa3",
      "url": "https://github.com/t81dev/t81-foundation/blob/274421fd8e85c5b9bb4f165fce190715530f4e85/docs/research/continuity/evidence/hanoi-arithmetic-results.json",
      "role": "negative",
      "uncertainty": "Recorded isolated counterexamples, not a full Hanoi build or new replication."
    },
    {
      "id": "hanoi-probe",
      "path": "docs/research/continuity/probes/reproduce_hanoi_arithmetic.py",
      "revision": "274421fd8e85c5b9bb4f165fce190715530f4e85",
      "sha256": "adc3ad2728ceebd1787b2c411fcf997b8b5c3d42027f408b9593b69f1bc5b040",
      "url": "https://github.com/t81dev/t81-foundation/blob/274421fd8e85c5b9bb4f165fce190715530f4e85/docs/research/continuity/probes/reproduce_hanoi_arithmetic.py",
      "role": "reproduction",
      "uncertainty": "Requires separate pinned Hanoi checkout and C compiler; writes output only if separately executed."
    },
    {
      "id": "h04-refinement",
      "path": "docs/research/continuity/H04_RADIX_ADAPTATION_DISCRIMINATOR.md",
      "revision": "274421fd8e85c5b9bb4f165fce190715530f4e85",
      "sha256": "cc392a610aff47da79f25e22dc95f976b553798bcd4416bbed6aa004ca02475b",
      "url": "https://github.com/t81dev/t81-foundation/blob/274421fd8e85c5b9bb4f165fce190715530f4e85/docs/research/continuity/H04_RADIX_ADAPTATION_DISCRIMINATOR.md",
      "role": "proposal",
      "uncertainty": "H04-R01 refinement, not replacement of historical H04."
    },
    {
      "id": "h04-r02",
      "path": "experiments/h04_r02_adaptive_representation/RESULTS.md",
      "revision": "274421fd8e85c5b9bb4f165fce190715530f4e85",
      "sha256": "7524c9466784378ce15f776be2407c520e6d222af2c181570481e3d67f87ca07",
      "url": "https://github.com/t81dev/t81-foundation/blob/274421fd8e85c5b9bb4f165fce190715530f4e85/experiments/h04_r02_adaptive_representation/RESULTS.md",
      "role": "reported",
      "uncertainty": "Reported four-arm symbolic model, not hardware or general software performance."
    },
    {
      "id": "h04-limitations",
      "path": "experiments/h04_r02_adaptive_representation/LIMITATIONS.md",
      "revision": "274421fd8e85c5b9bb4f165fce190715530f4e85",
      "sha256": "788a1b8c5ba95e50eaffb16459ffcb164defc872ba9eab6de331600bfed87f2e",
      "url": "https://github.com/t81dev/t81-foundation/blob/274421fd8e85c5b9bb4f165fce190715530f4e85/experiments/h04_r02_adaptive_representation/LIMITATIONS.md",
      "role": "reported",
      "uncertainty": "Explicit model/domain limits."
    },
    {
      "id": "h04-handoff",
      "path": "experiments/h04_r02_adaptive_representation/HANDOFF.md",
      "revision": "274421fd8e85c5b9bb4f165fce190715530f4e85",
      "sha256": "5c52ab7fef516f431801128de0f3e1b3d2a94ed97418546a92b946402bf1c730",
      "url": "https://github.com/t81dev/t81-foundation/blob/274421fd8e85c5b9bb4f165fce190715530f4e85/experiments/h04_r02_adaptive_representation/HANDOFF.md",
      "role": "disputed",
      "uncertainty": "Its blanket software-CPU conclusion exceeds model scope; preserve but do not adopt."
    },
    {
      "id": "arithmetic-report",
      "path": "docs/research/TERNARY_ARITHMETIC_AND_RADIX_COMPARISON.md",
      "revision": "274421fd8e85c5b9bb4f165fce190715530f4e85",
      "sha256": "bf5a373fa9955d13d3bd54daa94c4c53b9579575d9ded09ae92c770b82fbfc65",
      "url": "https://github.com/t81dev/t81-foundation/blob/274421fd8e85c5b9bb4f165fce190715530f4e85/docs/research/TERNARY_ARITHMETIC_AND_RADIX_COMPARISON.md",
      "role": "negative",
      "uncertainty": "Reported bounded software arithmetic comparison; not all hardware or algorithms."
    },
    {
      "id": "matvec-report",
      "path": "docs/research/PACKED_TERNARY_MATVEC_PERFORMANCE_REPORT.md",
      "revision": "274421fd8e85c5b9bb4f165fce190715530f4e85",
      "sha256": "7e9ac13e3e21877e80d06b84a5b186b4f96f315bcc1e3fd2d680a98d9823cab9",
      "url": "https://github.com/t81dev/t81-foundation/blob/274421fd8e85c5b9bb4f165fce190715530f4e85/docs/research/PACKED_TERNARY_MATVEC_PERFORMANCE_REPORT.md",
      "role": "negative",
      "uncertainty": "Reported scoped AVX2 throughput negative; compact storage is separate from speed/accuracy."
    },
    {
      "id": "corrective-07-08",
      "path": "docs/research/INVESTIGATIONS_07_08_CORRECTIVE_ASSESSMENT.md",
      "revision": "274421fd8e85c5b9bb4f165fce190715530f4e85",